{
 "id": "table-sword-alignment",
 "name": "Sword Alignment",
 "system": "openfrp74",
 "die_sides": 100,
 "usage": null,
 "rows": [
  {
   "min": 1,
   "max": 65,
   "result": "Lawful",
   "result_raw": null,
   "refs": [],
   "note": null
  },
  {
   "min": 66,
   "max": 90,
   "result": "Neutral",
   "result_raw": null,
   "refs": [],
   "note": null
  },
  {
   "min": 91,
   "max": 100,
   "result": "Chaotic",
   "result_raw": null,
   "refs": [],
   "note": null
  }
 ],
 "footnotes": [
  "Percentages reversed for the life-energy-draining sword (84-00 row 83 entry)",
  "Chaotic parenthetical-target swords strike Clerics/Pegasi/Hippogriffs/Rocs/Ents instead of Trolls/Undead"
 ],
 "interpretation_records": [],
 "source": {
  "work": "OpenFRP74",
  "booklet": "v2",
  "page": "p27",
  "blocks": [
   4,
   5,
   6
  ],
  "content_sha256": [
   "2c6da59b39f0bcd77044849ca94a167636f2956e60b1aeac848e33ce21eec9df",
   "e66644097593cfab455f6c00809580cf6cc5e5c993a8db41e5468add843f8164",
   "05f88f8b7957632fc93d89bda33049124c56c98bc0acc0b994b0e6c3178e1e9d"
  ]
 },
 "extraction": {
  "date": "2026-07-17",
  "model": "claude-opus-4-8",
  "notes": null
 }
}
