{
 "id": "etable-monster-level-1",
 "name": "Monster Level Table 1",
 "system": "openfrp74",
 "die_sides": 8,
 "usage": "Die result 0 = 10 per period convention (ir-a11).",
 "rows": [
  {
   "min": 1,
   "max": 1,
   "result": "Kobolds",
   "result_raw": null,
   "refs": [],
   "note": null
  },
  {
   "min": 2,
   "max": 2,
   "result": "Goblins",
   "result_raw": null,
   "refs": [],
   "note": null
  },
  {
   "min": 3,
   "max": 3,
   "result": "Skeletons",
   "result_raw": null,
   "refs": [],
   "note": null
  },
  {
   "min": 4,
   "max": 4,
   "result": "Orcs",
   "result_raw": null,
   "refs": [],
   "note": null
  },
  {
   "min": 5,
   "max": 5,
   "result": "Giant Rats",
   "result_raw": null,
   "refs": [],
   "note": null
  },
  {
   "min": 6,
   "max": 6,
   "result": "Centipedes",
   "result_raw": null,
   "refs": [],
   "note": null
  },
  {
   "min": 7,
   "max": 7,
   "result": "Bandits",
   "result_raw": null,
   "refs": [],
   "note": null
  },
  {
   "min": 8,
   "max": 8,
   "result": "Spiders",
   "result_raw": null,
   "refs": [],
   "note": null
  }
 ],
 "footnotes": [],
 "interpretation_records": [],
 "source": {
  "work": "OpenFRP74",
  "booklet": "v3",
  "page": "p10",
  "blocks": [
   5
  ],
  "content_sha256": [
   "90be38870397e8c3164406ffb5c8a3f0922eb3fc8cd51b9e7e660fb801083f04"
  ]
 },
 "extraction": {
  "date": "2026-07-17",
  "model": "claude-opus-4-8",
  "notes": null
 }
}
