{
 "id": "etable-wilderness-undead",
 "name": "Wilderness Undead Types",
 "system": "openfrp74",
 "die_sides": 8,
 "usage": null,
 "rows": [
  {
   "min": 1,
   "max": 1,
   "result": "Skeletons",
   "result_raw": null,
   "refs": [],
   "note": null
  },
  {
   "min": 2,
   "max": 2,
   "result": "Zombies",
   "result_raw": null,
   "refs": [],
   "note": null
  },
  {
   "min": 3,
   "max": 3,
   "result": "Ghouls",
   "result_raw": null,
   "refs": [],
   "note": null
  },
  {
   "min": 4,
   "max": 4,
   "result": "Wights",
   "result_raw": null,
   "refs": [],
   "note": null
  },
  {
   "min": 5,
   "max": 5,
   "result": "Wraiths",
   "result_raw": null,
   "refs": [],
   "note": null
  },
  {
   "min": 6,
   "max": 6,
   "result": "Mummies",
   "result_raw": null,
   "refs": [],
   "note": null
  },
  {
   "min": 7,
   "max": 7,
   "result": "Spectres",
   "result_raw": null,
   "refs": [],
   "note": null
  },
  {
   "min": 8,
   "max": 8,
   "result": "Vampires",
   "result_raw": null,
   "refs": [],
   "note": null
  }
 ],
 "footnotes": [],
 "interpretation_records": [],
 "source": {
  "work": "OpenFRP74",
  "booklet": "v3",
  "page": "p18",
  "blocks": [
   5
  ],
  "content_sha256": [
   "5a2fa68f7c5519e5b04e76a2ce960cf50b6b0ca3b5f25c90e53bfab044b8ab53"
  ]
 },
 "extraction": {
  "date": "2026-07-17",
  "model": "claude-opus-4-8",
  "notes": null
 }
}
