{
 "id": "table-curse-scroll",
 "name": "Curse Scroll Effects",
 "system": "openfrp74",
 "die_sides": 8,
 "usage": null,
 "rows": [
  {
   "min": 1,
   "max": 2,
   "result": "Any monster of the referee's choice",
   "result_raw": null,
   "refs": [],
   "note": null
  },
  {
   "min": 3,
   "max": 4,
   "result": "Disease, fatal in 3 turns unless healed",
   "result_raw": null,
   "refs": [],
   "note": null
  },
  {
   "min": 5,
   "max": 6,
   "result": "Polymorph to insect of referee's choice",
   "result_raw": null,
   "refs": [],
   "note": null
  },
  {
   "min": 7,
   "max": 7,
   "result": "Transportation 1,000 miles, random direction",
   "result_raw": null,
   "refs": [],
   "note": null
  },
  {
   "min": 8,
   "max": 8,
   "result": "Transportation to another planet",
   "result_raw": null,
   "refs": [],
   "note": null
  }
 ],
 "footnotes": [],
 "interpretation_records": [],
 "source": {
  "work": "OpenFRP74",
  "booklet": "v2",
  "page": "p25",
  "blocks": [
   0,
   1
  ],
  "content_sha256": [
   "db0f1ab6b7a050f3109d251762115948aba1a682aafafb0e70632aa15c40faae",
   "afebf6483501c84d205d1d4b6a05314ef50e550edf2dbcd0418a15637edaa60e"
  ]
 },
 "extraction": {
  "date": "2026-07-17",
  "model": "claude-opus-4-8",
  "notes": null
 }
}
