{
 "id": "etable-monster-level-4",
 "name": "Monster Level Table 4",
 "system": "openfrp74",
 "die_sides": 10,
 "usage": "Die result 0 = 10 per period convention (ir-a11).",
 "rows": [
  {
   "min": 1,
   "max": 1,
   "result": "Wraiths",
   "result_raw": null,
   "refs": [],
   "note": null
  },
  {
   "min": 2,
   "max": 2,
   "result": "Ogres",
   "result_raw": null,
   "refs": [],
   "note": null
  },
  {
   "min": 3,
   "max": 3,
   "result": "Evil Priests",
   "result_raw": null,
   "refs": [],
   "note": null
  },
  {
   "min": 4,
   "max": 4,
   "result": "Myrmidons",
   "result_raw": null,
   "refs": [],
   "note": null
  },
  {
   "min": 5,
   "max": 5,
   "result": "Giant Beetles",
   "result_raw": null,
   "refs": [],
   "note": null
  },
  {
   "min": 6,
   "max": 6,
   "result": "Giant Scorpions",
   "result_raw": null,
   "refs": [],
   "note": null
  },
  {
   "min": 7,
   "max": 7,
   "result": "Lycanthropes",
   "result_raw": null,
   "refs": [],
   "note": null
  },
  {
   "min": 8,
   "max": 8,
   "result": "Gargoyles",
   "result_raw": null,
   "refs": [],
   "note": null
  },
  {
   "min": 9,
   "max": 9,
   "result": "White Apes",
   "result_raw": null,
   "refs": [],
   "note": null
  },
  {
   "min": 10,
   "max": 10,
   "result": "Enchanters",
   "result_raw": "0",
   "refs": [],
   "note": null
  }
 ],
 "footnotes": [],
 "interpretation_records": [],
 "source": {
  "work": "OpenFRP74",
  "booklet": "v3",
  "page": "p10",
  "blocks": [
   8
  ],
  "content_sha256": [
   "c5cdbe67bc8740c063d0965b112fb8a72b616debcae34375e438e2104564573e"
  ]
 },
 "extraction": {
  "date": "2026-07-17",
  "model": "claude-opus-4-8",
  "notes": null
 }
}
