{
 "id": "etable-wilderness-lycanthropes",
 "name": "Wilderness Lycanthrope Types",
 "system": "openfrp74",
 "die_sides": 4,
 "usage": null,
 "rows": [
  {
   "min": 1,
   "max": 1,
   "result": "Werewolves",
   "result_raw": null,
   "refs": [],
   "note": null
  },
  {
   "min": 2,
   "max": 2,
   "result": "Wereboars",
   "result_raw": null,
   "refs": [],
   "note": null
  },
  {
   "min": 3,
   "max": 3,
   "result": "Weretigers",
   "result_raw": null,
   "refs": [],
   "note": null
  },
  {
   "min": 4,
   "max": 4,
   "result": "Werebears",
   "result_raw": null,
   "refs": [],
   "note": null
  }
 ],
 "footnotes": [],
 "interpretation_records": [],
 "source": {
  "work": "OpenFRP74",
  "booklet": "v3",
  "page": "p19",
  "blocks": [
   1
  ],
  "content_sha256": [
   "abf411ca037426e4a57e876c06e2a7b222df6092ed4bdca028061e7a3653f50d"
  ]
 },
 "extraction": {
  "date": "2026-07-17",
  "model": "claude-opus-4-8",
  "notes": null
 }
}
